{
  "spec_version": "1.0",
  "event_id": "00000000-0000-4000-8000-000000000002",
  "timestamp": "2026-04-22T10:00:00Z",
  "framework_source": "test",
  "workspace_id": "ws_min",
  "task": {
    "name": "noop",
    "outcome": "success"
  },
  "metrics": {
    "duration_ms": 0
  },
  "meta": {
    "sdk_language": "test",
    "sdk_version": "0.0.0"
  }
}
