{
  "spec_version": "1.0",
  "event_id": "00000000-0000-4000-8000-000000000004",
  "timestamp": "2026-04-22T10:10:00Z",
  "framework_source": "test",
  "workspace_id": "ws_ext",
  "task": {
    "name": "with_extensions",
    "category": "drafting",
    "outcome": "success"
  },
  "metrics": {
    "duration_ms": 1000,
    "tokens_prompt": 50,
    "tokens_completion": 50
  },
  "meta": {
    "sdk_language": "test",
    "sdk_version": "0.0.0",
    "extensions": {
      "vendor.custom_field": "ignored-by-scoring",
      "another": { "nested": true }
    }
  }
}
